<template xmlns="http://www.example.com/xsd2cocoa"
    xmlns:xsi="http://www.w3.org/2001/XMLSchema-instance"
    xsi:schemaLocation="http://www.example.com/xsd2cocoa template.xsd">
    
    <format_style>swift</format_style>
    
    <additional_file path="libxml-bridging-header.header" target_path="libxml-bridging-header.h"/>
    
    <!-- known simpletypes-->
    <simpletype name="string" objType="String" arrayType="[String]">
        <read>
            <prefix></prefix>
            <attribute><![CDATA[self.{{ attribute.variableName }} = String.fromCString(UnsafePointer<CChar>({{ attribute.name }}AttrValue))]]></attribute>
            <element>/*TODO*/</element>
            <value><![CDATA[let value = String.fromCString(UnsafePointer<CChar>(contentValue))
                self.value = value]]></value>
        </read>
    </simpletype>
    <simpletype name="anyURI" objType="NSURL" arrayType="[NSURL]">
        <read>
            <prefix></prefix>
            <attribute><![CDATA[self.{{ attribute.variableName }} = NSURL(string: String.fromCString(UnsafePointer<CChar>({{ attribute.name }}AttrValue))!)]]></attribute>
            <element>/*TODO*/</element>
            <value><![CDATA[let value = String.fromCString(UnsafePointer<CChar>(contentValue))
                self.value = NSURL(string: value)]]></value>
        </read>
    </simpletype>
    <simpletype name="boolean" objType="Bool" arrayType="[Bool]">
        <read>
            <prefix></prefix>
            <attribute>self.{{ attribute.variableName }} = [NSNumber numberWithBool: [[NSString stringWithCStringring: {{ attribute.name }}AttrValue encoding: NSUTF8StringEncoding] isEqualToString: @"true"]];</attribute>
            <element>/*TODO*/</element>
            <value>NSString *value = [NSString stringWithCString: contentValue encoding: NSUTF8StringEncoding];
                value = [value stringByTrimmingCharactersInSet:[NSCharacterSet whitespaceAndNewlineCharacterSet]];
                self.value = [NSNumber numberWithBool: [value isEqualToString: @"true"]];</value>
        </read>
    </simpletype>
    <simpletype name="integer" objType="Int" arrayType="[Int]">
        <read>
            <prefix>NSNumberFormatter* numFormatter = [[NSNumberFormatter alloc] init];
                numFormatter.numberStyle = NSNumberFormatterDecimalStyle;</prefix>
            <attribute>self.{{ attribute.variableName }} = [numFormatter numberFromString: [NSString stringWithCString: {{ attribute.name }}AttrValue encoding: NSUTF8StringEncoding]];</attribute>
            <element>/*TODO*/</element>
            <value>NSString *value = [NSString stringWithCString: contentValue encoding: NSUTF8StringEncoding];
                value = [value stringByTrimmingCharactersInSet:[NSCharacterSet whitespaceAndNewlineCharacterSet]];
                self.value = [numFormatter numberFromString: value];</value>
        </read>
    </simpletype>
    <simpletype name="decimal" objType="Double" arrayType="[Double]">
        <read>
            <prefix>NSNumberFormatter* decFormatter = [[NSNumberFormatter alloc] init];
                decFormatter.decimalSeparator = @".";
                decFormatter.numberStyle = NSNumberFormatterDecimalStyle;</prefix>
            <attribute>self.{{ attribute.variableName }} = [decFormatter numberFromString: [NSString stringWithCString: {{ attribute.name }}AttrValue encoding: NSUTF8StringEncoding]];</attribute>
            <element>/*TODO*/</element>
            <value>NSString *value = [NSString stringWithCString: contentValue encoding: NSUTF8StringEncoding];
                value = [value stringByTrimmingCharactersInSet:[NSCharacterSet whitespaceAndNewlineCharacterSet]];
                self.value = [decFormatter numberFromString: value];</value>
        </read>
    </simpletype>
    <simpletype name="dateTime" objType="NSDate" arrayType="[NSDate]">
        <read>
            <prefix>NSDateFormatter* dateFormatter = [[NSDateFormatter alloc] init];
                dateFormatter.timeStyle = NSDateFormatterFullStyle;
                dateFormatter.dateFormat = @"yyyy-MM-dd'T'HH:mm:ssZ";</prefix>
            <attribute>self.{{ attribute.variableName }} = [dateFormatter dateFromString: [NSString stringWithCString: {{ attribute.name }}AttrValue encoding: NSUTF8StringEncoding]];</attribute>
            <element>/*TODO*/</element>
            <value>NSString *value = [NSString stringWithCString: contentValue encoding: NSUTF8StringEncoding];
                value = [value stringByTrimmingCharactersInSet:[NSCharacterSet whitespaceAndNewlineCharacterSet]];
                self.value = [dateFormatter dateFromString: value];</value>
        </read>
    </simpletype>
    
    <!--complex type-->
    <complextype arrayType="[{{ type.targetClassName }}]">
        <read>
            <element><![CDATA[{% if element.isSingleValue %}self.{{ element.variableName }} = {{ element.codeType }}(reader: reader){% else %}{{ element.variableName }}Array.append({{ element.schemaType.targetClassName }}(reader: reader)){% /if %}]]></element>
        </read>
    </complextype>
    
    <implementation>
        <header extension=""></header>
        <class extension="swift"><![CDATA[
            import Foundation
            
            @objc
            class {{ type.targetClassName }} {% if type.hasComplexBaseClass %}: {{ type.baseClassName }} {% /if %}{
            {% for attribute in type.attributes %}
            var {{ attribute.variableName }}: {{ attribute.codeType }}?
            {% /for %}
            {% for element in type.elements %}    var {{ element.variableName }}: {{ element.codeType }}?
            {% /for %}
            {% if type.hasSimpleBaseClass %}
            var value: {{ type.baseClassName }}?{% /if %}
            
            {% if type.hasComplexBaseClass %}override {% /if %}func readAttributes(reader: xmlTextReaderPtr) {{% if type.hasComplexBaseClass %}
            super.readAttributes(reader)
            {% /if %}{{ type.combinedReadPrefixCode }}
            
            {% for attribute in type.attributes %}          let {{ attribute.name }}AttrName = UnsafePointer<xmlChar>(NSString(stringLiteral: "{{ attribute.name }}").UTF8String)
            let {{ attribute.name }}AttrValue = xmlTextReaderGetAttribute(reader, {{ attribute.name }}AttrName)
            if({{ attribute.name }}AttrValue != nil) {
            {{ attribute.readCodeForAttribute }}
            }{% /for %}
            }
            
            {% if type.hasComplexBaseClass %}override {% /if %}init(reader: xmlTextReaderPtr) {
            let _complexTypeXmlDept = xmlTextReaderDepth(reader)
            {% if type.hasComplexBaseClass %}super.init(reader: reader){% /if %}
            {{ type.combinedReadPrefixCode }}{% if type.hasComplexBaseClass %}{% else %}
            self.readAttributes(reader){% /if %}
            {% for element in type.elements %}
            {% if element.isSingleValue %}{% else %}var {{ element.variableName }}Array = {{ element.codeType }}(){% /if %}{% /for %}
            
            {% if type.hasComplexBaseClass %}var _readerOk:Int32=1{% else %}var _readerOk = xmlTextReaderRead(reader){% /if %}
            var _currentNodeType = xmlTextReaderNodeType(reader)
            var _currentXmlDept = xmlTextReaderDepth(reader)
            
            while(_readerOk > 0 && _currentNodeType != 0/*XML_READER_TYPE_NONE*/ && _complexTypeXmlDept < _currentXmlDept) {
            var handledInChild = false
            if(_currentNodeType == 1/*XML_READER_TYPE_ELEMENT*/ || _currentNodeType == 3/*XML_READER_TYPE_TEXT*/) {
            let _currentElementNameXmlChar = xmlTextReaderConstLocalName(reader)
            let _currentElementName = String.fromCString(UnsafePointer<CChar>(_currentElementNameXmlChar))
            {% for element in type.elements %}if("{{element.name}}" == _currentElementName) {
            {{ element.readCodeForContent }}
            {% if element.hasComplexType %}
            handledInChild = true{% /if %}
            } else {% /for %} {% if type.hasSimpleBaseClass %} if("#text" == _currentElementName){
            let contentValue = xmlTextReaderConstValue(reader)
            if(contentValue != nil) {
            {{ type.readSimpleContent }}
            }
            } else {% /if %} if(true) {
            println("Ignoring unexpected: \(_currentElementName)")
            break
            }
            }
            _readerOk = handledInChild ? xmlTextReaderReadState(reader) : xmlTextReaderRead(reader)
            _currentNodeType = xmlTextReaderNodeType(reader)
            _currentXmlDept = xmlTextReaderDepth(reader)
            }
            {% for element in type.elements %}
            {% if element.isSingleValue %}{% else %}if({{ element.variableName }}Array.count > 0) { self.{{ element.variableName }} = {{ element.variableName }}Array }{% /if %}{% /for %}
            }
            
            {% if type.hasComplexBaseClass %}override {% /if %}var dictionary: [String: AnyObject] {
            var dict = [String: AnyObject]()
            {% if type.hasComplexBaseClass %}for (name, value) in super.dictionary {
            dict[name] = value
            }{% /if %}
            
            {% for attribute in type.attributes %}
            if(self.{{ attribute.variableName }} != nil) { dict["{{ attribute.variableName }}"] = self.{{ attribute.variableName }} }{% /for %}
            {% for element in type.elements %}
            {% if element.hasComplexType %}
            if(self.{{ element.variableName }} != nil) {
            dict["{{ element.variableName }}"] = self.{{ element.variableName }}!{% if element.isSingleValue %}{% else %}.map({$0.dictionary}){% /if %}
            }
            {% else %} if(self.{{ element.variableName }} != nil) { dict["{{ element.variableName }}"] = self.{{ element.variableName }} }{% /if %}
            {% /for %}
            {% if type.hasSimpleBaseClass %}    if(self.value != nil) { dict["value"] = self.value }{% /if %}